{
  "$schema": "./schemas/upstream-lock.schema.json",
  "schemaVersion": 1,
  "upstream": {
    "repository": "anomalyco/opencode",
    "version": "1.18.25",
    "tag": "v1.18.25",
    "commit": "cb7d8b2f5e44876ef98b661dc10590c915af3a9f",
    "releaseTargetCommit": "733562e92a96255fb123aae92f267e4534a635fb",
    "sourceArchiveSha256": "8a958c8d72084f74d8c4b99b769267bacc88cd6612ba2bb5fd33018a2e4efb07"
  },
  "binaries": {
    "windowsX64": {
      "name": "opencode-windows-x64.zip",
      "url": "https://github.com/anomalyco/opencode/releases/download/v1.18.25/opencode-windows-x64.zip",
      "sha256": "831e213e5f454d6e8b26f0fb24c7b3d42b40e47d73d154672a9192702eb08416",
      "size": 60659144
    },
    "linuxX64": {
      "name": "opencode-linux-x64.tar.gz",
      "url": "https://github.com/anomalyco/opencode/releases/download/v1.18.25/opencode-linux-x64.tar.gz",
      "sha256": "58a3729a6f3432dd6d2917fcc4a949788891a035818646ad480e12c947f56e78",
      "size": 60534407
    }
  },
  "protocol": {
    "openapiPath": "packages/sdk/openapi.json",
    "sourceOpenapiSha256": "c0af493bae06c8f50ae05474921570eb05f301c92a5f68f6a6365f530b719ad7",
    "openapiSha256": "dfb7d42a555389f0c662fa2b4a8af1d61633c96710cf54bce3ff2404e2e7d896",
    "manifestPath": "generated/route-capabilities.json",
    "manifestSha256": "8be6e49fe0f413e3113fcbecbf20219be6ba29c125e61c59b9e26acab3371387"
  },
  "networkBaseline": {
    "platformFetchReferences": 11,
    "directWebSockets": ["packages/app/src/components/terminal.tsx"],
    "directEventSources": [],
    "directWorkers": [],
    "globalFetchAllowlist": ["packages/app/src/utils/draft-store.ts"]
  },
  "reference": {
    "project": "AIALRA-KIMI",
    "commit": "56b2e18"
  }
}
